{
  "protocol": "dev.jazz.capture-coach-live",
  "protocolVersion": 1,
  "scenario": "interrupted_recovery",
  "events": [
    {
      "kind": "send_message",
      "method": "POST",
      "endpoint": "/api/capture-coach/live/messages",
      "document": {
        "documentType": "message",
        "schemaVersion": 1,
        "messageId": "ccm-0190a004-0000-7000-8000-000000000004",
        "scope": {
          "companyId": "company-001",
          "areaId": "area-finance",
          "processId": "process-interrupted-recovery",
          "deviceId": "device-macos-004"
        },
        "producer": {
          "producerId": "producer-macos-004",
          "kind": "native_desktop",
          "version": "1.0.0",
          "capabilities": [
            "accessibility",
            "transcript"
          ],
          "unavailableCapabilities": []
        },
        "captureId": "cap-0190a004-0000-7000-8000-000000000001",
        "labelId": "l-0190a004-0000-7000-8000-000000000002",
        "createdAt": "2026-07-24T11:00:04.000Z",
        "inputWatermark": {
          "schemaVersion": 2,
          "captureId": "cap-0190a004-0000-7000-8000-000000000001",
          "streams": [
            {
              "streamId": "stream-0190a004-0000-7000-8000-000000000003",
              "throughSequence": 4
            }
          ],
          "transcripts": [
            {
              "transcriptId": "transcript-native-0190a004",
              "revision": 1,
              "throughMillis": 4000,
              "textDigest": "7cbb865ce3061dd84b0b905adb2e2f9f05dac8cf55d881208fd5655ecae458b9",
              "finalized": false
            }
          ]
        },
        "evidence": [
          {
            "kind": "transcriptSpan",
            "transcriptId": "transcript-native-0190a004",
            "revision": 1,
            "startMillis": 0,
            "endMillis": 4000,
            "text": "I check the recovery queue before I continue.",
            "textDigest": "7cbb865ce3061dd84b0b905adb2e2f9f05dac8cf55d881208fd5655ecae458b9",
            "finalized": false
          }
        ],
        "contentDigest": "bb6d434786a970e97305f42acd33754e433e15b3febec73e53a0ca8789d362b0"
      },
      "canonicalBytes": "{\"captureId\":\"cap-0190a004-0000-7000-8000-000000000001\",\"contentDigest\":\"bb6d434786a970e97305f42acd33754e433e15b3febec73e53a0ca8789d362b0\",\"createdAt\":\"2026-07-24T11:00:04.000Z\",\"documentType\":\"message\",\"evidence\":[{\"endMillis\":4000,\"finalized\":false,\"kind\":\"transcriptSpan\",\"revision\":1,\"startMillis\":0,\"text\":\"I check the recovery queue before I continue.\",\"textDigest\":\"7cbb865ce3061dd84b0b905adb2e2f9f05dac8cf55d881208fd5655ecae458b9\",\"transcriptId\":\"transcript-native-0190a004\"}],\"inputWatermark\":{\"captureId\":\"cap-0190a004-0000-7000-8000-000000000001\",\"schemaVersion\":2,\"streams\":[{\"streamId\":\"stream-0190a004-0000-7000-8000-000000000003\",\"throughSequence\":4}],\"transcripts\":[{\"finalized\":false,\"revision\":1,\"textDigest\":\"7cbb865ce3061dd84b0b905adb2e2f9f05dac8cf55d881208fd5655ecae458b9\",\"throughMillis\":4000,\"transcriptId\":\"transcript-native-0190a004\"}]},\"labelId\":\"l-0190a004-0000-7000-8000-000000000002\",\"messageId\":\"ccm-0190a004-0000-7000-8000-000000000004\",\"producer\":{\"capabilities\":[\"accessibility\",\"transcript\"],\"kind\":\"native_desktop\",\"producerId\":\"producer-macos-004\",\"unavailableCapabilities\":[],\"version\":\"1.0.0\"},\"schemaVersion\":1,\"scope\":{\"areaId\":\"area-finance\",\"companyId\":\"company-001\",\"deviceId\":\"device-macos-004\",\"processId\":\"process-interrupted-recovery\"}}",
      "transportResult": "accepted",
      "httpStatus": 200,
      "ackResponse": {
        "documentType": "message_ack",
        "schemaVersion": 1,
        "messageId": "ccm-0190a004-0000-7000-8000-000000000004",
        "contentDigest": "bb6d434786a970e97305f42acd33754e433e15b3febec73e53a0ca8789d362b0",
        "status": "stored"
      },
      "responseCanonicalBytes": "{\"contentDigest\":\"bb6d434786a970e97305f42acd33754e433e15b3febec73e53a0ca8789d362b0\",\"documentType\":\"message_ack\",\"messageId\":\"ccm-0190a004-0000-7000-8000-000000000004\",\"schemaVersion\":1,\"status\":\"stored\"}"
    },
    {
      "kind": "receive_prompt",
      "method": "GET",
      "endpoint": "/api/capture-coach/live/prompts/next",
      "document": {
        "documentType": "prompt",
        "schemaVersion": 1,
        "promptId": "prompt-0190a004-0000-7000-8000-000000000005",
        "scope": {
          "companyId": "company-001",
          "areaId": "area-finance",
          "processId": "process-interrupted-recovery",
          "deviceId": "device-macos-004"
        },
        "captureId": "cap-0190a004-0000-7000-8000-000000000001",
        "labelId": "l-0190a004-0000-7000-8000-000000000002",
        "sourceMessageIds": [
          "ccm-0190a004-0000-7000-8000-000000000004"
        ],
        "assessmentRef": {
          "assessmentId": "cqa-0190a004-0000-7000-8000-000000000006",
          "revision": 1,
          "inputDigest": "1350faee3168f46bc9f2151a146dc349c767d232252ea5527ad1925e5ab209d7"
        },
        "inputWatermark": {
          "schemaVersion": 2,
          "captureId": "cap-0190a004-0000-7000-8000-000000000001",
          "streams": [
            {
              "streamId": "stream-0190a004-0000-7000-8000-000000000003",
              "throughSequence": 4
            }
          ],
          "transcripts": [
            {
              "transcriptId": "transcript-native-0190a004",
              "revision": 1,
              "throughMillis": 4000,
              "textDigest": "7cbb865ce3061dd84b0b905adb2e2f9f05dac8cf55d881208fd5655ecae458b9",
              "finalized": false
            }
          ]
        },
        "snapshot": {
          "text": "Which queue state prevents the next step?",
          "slot": "exception",
          "policyVersion": "capture-coach-live-policy/v1",
          "responseModes": [
            "typed_text",
            "spoken"
          ]
        },
        "issuedAt": "2026-07-24T11:00:05.000Z",
        "contentDigest": "59f8f3338b0f3c695292e991e64e5687b227add101f8902ede216fd9ba78a406"
      },
      "canonicalBytes": "{\"assessmentRef\":{\"assessmentId\":\"cqa-0190a004-0000-7000-8000-000000000006\",\"inputDigest\":\"1350faee3168f46bc9f2151a146dc349c767d232252ea5527ad1925e5ab209d7\",\"revision\":1},\"captureId\":\"cap-0190a004-0000-7000-8000-000000000001\",\"contentDigest\":\"59f8f3338b0f3c695292e991e64e5687b227add101f8902ede216fd9ba78a406\",\"documentType\":\"prompt\",\"inputWatermark\":{\"captureId\":\"cap-0190a004-0000-7000-8000-000000000001\",\"schemaVersion\":2,\"streams\":[{\"streamId\":\"stream-0190a004-0000-7000-8000-000000000003\",\"throughSequence\":4}],\"transcripts\":[{\"finalized\":false,\"revision\":1,\"textDigest\":\"7cbb865ce3061dd84b0b905adb2e2f9f05dac8cf55d881208fd5655ecae458b9\",\"throughMillis\":4000,\"transcriptId\":\"transcript-native-0190a004\"}]},\"issuedAt\":\"2026-07-24T11:00:05.000Z\",\"labelId\":\"l-0190a004-0000-7000-8000-000000000002\",\"promptId\":\"prompt-0190a004-0000-7000-8000-000000000005\",\"schemaVersion\":1,\"scope\":{\"areaId\":\"area-finance\",\"companyId\":\"company-001\",\"deviceId\":\"device-macos-004\",\"processId\":\"process-interrupted-recovery\"},\"snapshot\":{\"policyVersion\":\"capture-coach-live-policy/v1\",\"responseModes\":[\"typed_text\",\"spoken\"],\"slot\":\"exception\",\"text\":\"Which queue state prevents the next step?\"},\"sourceMessageIds\":[\"ccm-0190a004-0000-7000-8000-000000000004\"]}",
      "transportResult": "delivered",
      "httpStatus": 200,
      "query": {
        "companyId": "company-001",
        "areaId": "area-finance",
        "processId": "process-interrupted-recovery",
        "deviceId": "device-macos-004",
        "captureId": "cap-0190a004-0000-7000-8000-000000000001",
        "labelId": "l-0190a004-0000-7000-8000-000000000002"
      },
      "displayed": false,
      "disposition": "interrupted_capture",
      "recoveryState": "intent_only"
    },
    {
      "kind": "send_receipt",
      "method": "POST",
      "endpoint": "/api/capture-coach/live/receipts",
      "document": {
        "documentType": "receipt",
        "schemaVersion": 1,
        "receiptId": "ccr-0190a004-0000-7000-8000-000000000007",
        "scope": {
          "companyId": "company-001",
          "areaId": "area-finance",
          "processId": "process-interrupted-recovery",
          "deviceId": "device-macos-004"
        },
        "promptId": "prompt-0190a004-0000-7000-8000-000000000005",
        "promptDigest": "59f8f3338b0f3c695292e991e64e5687b227add101f8902ede216fd9ba78a406",
        "captureId": "cap-0190a004-0000-7000-8000-000000000001",
        "labelId": "l-0190a004-0000-7000-8000-000000000002",
        "assessmentId": "cqa-0190a004-0000-7000-8000-000000000006",
        "inputWatermark": {
          "schemaVersion": 2,
          "captureId": "cap-0190a004-0000-7000-8000-000000000001",
          "streams": [
            {
              "streamId": "stream-0190a004-0000-7000-8000-000000000003",
              "throughSequence": 4
            }
          ],
          "transcripts": [
            {
              "transcriptId": "transcript-native-0190a004",
              "revision": 1,
              "throughMillis": 4000,
              "textDigest": "7cbb865ce3061dd84b0b905adb2e2f9f05dac8cf55d881208fd5655ecae458b9",
              "finalized": false
            }
          ]
        },
        "action": "suppressed",
        "canonicalInteractions": [
          {
            "interactionId": "coach-0190a004-0000-7000-8000-000000000008",
            "interactionType": "suppressed"
          }
        ],
        "occurredAt": "2026-07-24T11:00:05.010Z",
        "clientRecordedAt": "2026-07-24T11:00:05.010Z",
        "suppressionReason": "interrupted_capture",